[{"id":"movie:00251","title":"现代启示录","original":"Apocalypse Now","type":"电影","director":"弗朗西斯·福特·科波拉","country":"美国","year":1979,"rating":4,"date":"2022-06-06","synopsis":"越战期间，威拉德上尉受命溯流而上，深入柬埔寨丛林，刺杀据传已疯狂叛变、自立为王的特种部队军官库尔兹上校。沿途所见的战争荒诞与暴力，将他一步步推向黑暗的内心深处。","locations":[{"kind":"country","place":"美国","lng":-118.24,"lat":34.05,"confidence":0.45}]},{"id":"movie:00252","title":"男孩遇见女孩","original":"Boy Meets Girl","type":"电影","director":"莱奥·卡拉克斯","country":"法国","year":1984,"rating":5,"date":"2022-06-06","synopsis":"黑白影像下的夜巴黎，刚被女友抛弃的青年阿历克斯怀着导演梦游荡街头，邂逅一位因被情人抛弃而想轻生的年轻女子。一夜之间，两个失意灵魂被命运牵引，陷入一段躁动而忧郁的青春相遇。","locations":[{"kind":"country","place":"法国","lng":2.35,"lat":48.85,"confidence":0.45}]},{"id":"movie:00253","title":"法兰西特派","original":"The French Dispatch","type":"电影","director":"韦斯·安德森","country":"美国","year":2021,"rating":4,"date":"2022-06-04","synopsis":"一份设于虚构法国小镇的美国杂志《法兰西特派》主编离世，遗愿要求停刊。影片以杂志最后一期为框架，通过数位记者各自的报道，串联起艺术、学运、美食等几则风格独特的故事。","locations":[{"kind":"country","place":"美国","lng":-118.24,"lat":34.05,"confidence":0.45}]},{"id":"movie:00254","title":"东京教父","original":"東京ゴッドファーザーズ","type":"动画电影","director":"今敏","country":"日本","year":2003,"rating":4,"date":"2022-06-04","synopsis":"圣诞夜的东京，三个无家可归者——中年酗酒赌徒阿仁、变性人花姐与离家少女美由纪，在垃圾堆中发现一名弃婴。三人决定踏上寻找婴儿父母的旅途，途中各自直面被掩埋的过往与悔恨。","locations":[{"kind":"country","place":"日本","lng":139.69,"lat":35.68,"confidence":0.45}]},{"id":"movie:00255","title":"最臭兵器","original":"","type":"动画短片","director":"冈村天斋","country":"日本","year":1995,"rating":3,"date":"2022-06-02","synopsis":"《回忆三部曲》中的一段。制药公司小职员田中信男误服公司与军方合作研发的实验药品，自身变成制造致命臭气的肉身工厂却毫不自知。他奉命携样本送往东京途中一路引发恐慌，军方遂出动大批兵力围堵。","locations":[{"kind":"country","place":"日本","lng":139.69,"lat":35.68,"confidence":0.45}]},{"id":"movie:00256","title":"阿基拉","original":"Akira","type":"动画电影","director":"大友克洋","country":"日本","year":1988,"rating":4,"date":"2022-05-31","synopsis":"2019年，毁于大爆炸后重建的赛博朋克都市新东京。暴走族少年铁雄因事故觉醒超能力并逐渐失控，好友金田与军方、抵抗组织围绕代号「阿基拉」的超能力实验卷入混乱。","locations":[{"kind":"country","place":"日本","lng":139.69,"lat":35.68,"confidence":0.45}]},{"id":"movie:00257","title":"她的回忆","original":"彼女の想いで","type":"动画短片","director":"森本晃司","country":"日本","year":1995,"rating":5,"date":"2022-05-30","synopsis":"动画合集《回忆三部曲》之第一篇。2092年，太空垃圾回收船船员循着含《蝴蝶夫人》咏叹调的神秘信号，进入一艘废弃飞船，逐渐陷入昔日歌剧女伶艾娃布下的全息幻境。","locations":[{"kind":"country","place":"日本","lng":139.69,"lat":35.68,"confidence":0.45}]},{"id":"movie:00258","title":"月球","original":"Moon","type":"电影","director":"邓肯·琼斯","country":"英国","year":2009,"rating":5,"date":"2022-05-26","synopsis":"在月球背面独自驻守、开采氦-3的矿工山姆，三年合约将满即可返回地球。在仅有智能助理GERTY相伴的孤独中，一场意外引出一连串令他动摇自我认知的不安事件。","locations":[{"kind":"country","place":"英国","lng":-0.12,"lat":51.5,"confidence":0.45}]},{"id":"movie:00259","title":"夜空总有最大密度的蓝色","original":"夜空はいつでも最高密度の青色だ","type":"电影","director":"石井裕也","country":"日本","year":2017,"rating":3,"date":"2022-05-26","synopsis":"改编自最果夕日同名诗集。在东京谋生的护士美香与右眼失明的工地工人慎二，两个孤独的边缘人在城市的喧嚣中相遇，彼此试探、靠近，缓缓展开一段都市男女的爱情故事。","locations":[{"kind":"country","place":"日本","lng":139.69,"lat":35.68,"confidence":0.45}]},{"id":"movie:00260","title":"钢的琴","original":"","type":"电影","director":"张猛","country":"中国大陆","year":2011,"rating":4,"date":"2022-05-26","synopsis":"上世纪末东北老工业区，下岗钢厂工人陈桂林为留住爱弹钢琴的女儿，召集昔日工友，用废弃钢材自制一架「钢的琴」。一群失意工人在荒诞与温情中重拾尊严。","locations":[{"kind":"country","place":"中国大陆","lng":116.4,"lat":39.9,"confidence":0.45}]},{"id":"movie:00261","title":"十二夜","original":"","type":"电影","director":"林爱华","country":"中国香港","year":2000,"rating":4,"date":"2022-05-26","synopsis":"空姐Jeannie与工程师Alan偶然相遇相恋。影片以十二个夜晚为章节，细腻描摹一段都市恋情从热烈投入到逐渐转淡、挣扎挽回的完整历程。（注：同名片另有2013年台湾流浪狗纪录片，此条据无外文原名按香港经典爱情片判定，存在歧义。）","locations":[{"kind":"country","place":"中国香港","lng":114.17,"lat":22.32,"confidence":0.45}]},{"id":"movie:00262","title":"啊，荒野 后篇","original":"あゝ、荒野 後篇","type":"电影","director":"岸善幸","country":"日本","year":2017,"rating":5,"date":"2022-05-26","synopsis":"改编自寺山修司同名小说，舞台设于近未来新宿。出狱的不良少年新次与患口吃、有社交恐惧的健二，因拳击结缘。后篇延续二人在擂台与命运中的羁绊与冲撞。","locations":[{"kind":"country","place":"日本","lng":139.69,"lat":35.68,"confidence":0.45}]},{"id":"movie:00263","title":"啊，荒野 前篇","original":"あゝ、荒野 前篇","type":"电影","director":"岸善幸","country":"日本","year":2017,"rating":5,"date":"2022-05-26","synopsis":"改编自寺山修司同名小说，舞台设于近未来新宿。从少年院出来的不良少年新次，与有口吃及社交恐惧的健二，因拳击相遇相识。前篇讲述二人结缘、踏上拳击之路的开端。","locations":[{"kind":"country","place":"日本","lng":139.69,"lat":35.68,"confidence":0.45}]},{"id":"movie:00264","title":"世界上最糟糕的人","original":"Verdens verste menneske","type":"电影","director":"约阿希姆·提尔","country":"挪威","year":2021,"rating":5,"date":"2022-05-26","synopsis":"「奥斯陆三部曲」终章。年近三十的奥斯陆女子尤利娅在事业与爱情间反复摇摆，于两段感情与自我追寻之间游移，以略带苦涩的浪漫喜剧笔触描摹当代年轻人的迷惘。","locations":[{"kind":"country","place":"挪威","lng":10.75,"lat":59.91,"confidence":0.45}]},{"id":"movie:00265","title":"心之全蚀","original":"Total Eclipse","type":"电影","director":"阿格涅丝卡·霍兰","country":"波兰","year":1995,"rating":5,"date":"2022-05-26","synopsis":"改编自克里斯托弗·汉普顿剧作。1871年，少年诗人兰波应名诗人魏尔伦之邀来到巴黎，两位法国象征派诗人陷入一段彼此吸引又相互伤害的炽烈关系。","locations":[{"kind":"country","place":"波兰","lng":21.01,"lat":52.23,"confidence":0.45}]},{"id":"movie:00266","title":"喜福会","original":"The Joy Luck Club","type":"电影","director":"王颖","country":"美国","year":1993,"rating":4,"date":"2022-05-26","synopsis":"改编自谭恩美小说。旧金山四位华人移民母亲常聚一起打麻将、讲述往事，她们与各自成年的美籍华裔女儿之间，因中美文化差异与代际隔阂而暗藏纠葛，在回忆中逐渐相互理解。","locations":[{"kind":"country","place":"美国","lng":-118.24,"lat":34.05,"confidence":0.45}]},{"id":"movie:00267","title":"铁西区第一部分：工厂","original":"","type":"纪录片","director":"王兵","country":"中国大陆","year":2003,"rating":null,"publicRating":8.5,"date":"","synopsis":"纪录片《铁西区》第一部分。镜头静观世纪之交沈阳老工业区一座大型工厂，跟随工人穿行于破败的休息室、浴室与车间，记录他们的闲谈与日常，直至面临全体下岗的衰败图景。","locations":[{"kind":"country","place":"中国大陆","lng":116.4,"lat":39.9,"confidence":0.45}]},{"id":"movie:00268","title":"孩子王","original":"","type":"电影","director":"陈凯歌","country":"中国大陆","year":1987,"rating":5,"date":"2022-05-26","synopsis":"改编自阿城小说。文革期间，插队多年的知青老杆被调往云贵山区一所简陋小学任教，被同伴戏称「孩子王」。他在僵化教条中尝试以己之法教孩子识字写作，触碰时代的精神困境。","locations":[{"kind":"country","place":"中国大陆","lng":116.4,"lat":39.9,"confidence":0.45}]},{"id":"movie:00269","title":"降临","original":"Arrival","type":"电影","director":"丹尼斯·维伦纽瓦","country":"加拿大","year":2016,"rating":5,"date":"2022-05-26","synopsis":"改编自姜峯楠《你一生的故事》。十二艘神秘外星飞船降临地球，语言学家路易斯受军方之邀，与物理学家伊恩合作破译外星语言，在沟通中渐渐触及关于时间与命运的认知。","locations":[{"kind":"country","place":"加拿大","lng":-79.38,"lat":43.65,"confidence":0.45}]},{"id":"movie:00270","title":"爱，死亡和机器人第三季","original":"Love, Death & Robots Season 3","type":"动画剧集","director":"蒂姆·米勒、大卫·芬奇","country":"美国","year":2022,"rating":5,"date":"2022-05-26","synopsis":"由蒂姆·米勒与大卫·芬奇主创的成人向科幻动画选集第三卷，收录九集风格各异的独立短片，涵盖变异生物、外星昆虫、太空惊悚等怪诞而黑暗的故事，各集由不同团队制作。","locations":[{"kind":"country","place":"美国","lng":-118.24,"lat":34.05,"confidence":0.45}]},{"id":"movie:00271","title":"大世界","original":"","type":"动画电影","director":"刘健","country":"中国大陆","year":2017,"rating":4,"date":"2022-05-26","synopsis":"中国南方某小镇，工地司机小张为给整容失败的女友筹措手术费，偷走老板的一袋巨款，由此引发一连串围绕这笔钱的荒诞而暴力的连锁反应，众多人物的命运因贪欲交织碰撞。","locations":[{"kind":"country","place":"中国大陆","lng":116.4,"lat":39.9,"confidence":0.45}]},{"id":"movie:00272","title":"刺痛我","original":"","type":"动画电影","director":"刘健","country":"中国大陆","year":2010,"rating":4,"date":"2022-05-23","synopsis":"金融危机背景下的南京，下岗工人、劫匪、按摩女等底层人物因一桩抢劫案被卷入彼此的命运。影片以冷峻笔触描摹都市边缘人的生存困境与愤怒无力。","locations":[{"kind":"country","place":"中国大陆","lng":116.4,"lat":39.9,"confidence":0.45}]},{"id":"movie:00273","title":"那山那人那狗","original":"","type":"电影","director":"霍建起","country":"中国大陆","year":1999,"rating":4,"date":"2022-03-27","synopsis":"上世纪八十年代的湘西山区，即将退休的乡邮员带着接班的儿子第一次走完邮路。父子在崇山峻岭的跋涉中，从隔阂走向理解，重新读懂彼此与这片土地。","locations":[{"kind":"country","place":"中国大陆","lng":116.4,"lat":39.9,"confidence":0.45}]},{"id":"movie:00274","title":"阿飞正传","original":"阿飞正傳","type":"电影","director":"王家卫","country":"中国香港","year":1990,"rating":4,"date":"2022-03-27","synopsis":"1960年代的香港，孤傲叛逆的旭仔自幼由养母带大，从未见过生母，对身边的女人冷漠无情。他游走于两个爱他的女子之间，并执意踏上寻找生母的旅程。","locations":[{"kind":"country","place":"中国香港","lng":114.17,"lat":22.32,"confidence":0.45}]},{"id":"movie:00275","title":"请以你的名字呼唤我","original":"Call Me by Your Name","type":"电影","director":"卢卡·瓜达尼诺","country":"意大利","year":2017,"rating":5,"date":"2022-03-26","synopsis":"1983年意大利北部的夏天，十七岁少年埃利奥与来家中协助父亲研究的美国博士生奥利弗相遇。在慵懒的乡间时光里，两人之间渐渐萌生出微妙而炽烈的情愫。","locations":[{"kind":"country","place":"意大利","lng":12.49,"lat":41.9,"confidence":0.45}]},{"id":"movie:00276","title":"花束般的恋爱","original":"花束みたいな恋をした","type":"电影","director":"土井裕泰","country":"日本","year":2021,"rating":5,"date":"2022-03-12","synopsis":"因错过末班车而邂逅的大学生山音麦与八谷绢，因兴趣相投迅速相恋同居。然而步入社会后，生活的现实与节奏差异让两人曾经契合的感情渐渐生变。","locations":[{"kind":"country","place":"日本","lng":139.69,"lat":35.68,"confidence":0.45}]},{"id":"movie:00277","title":"火口的两人","original":"火口のふたり","type":"电影","director":"荒井晴彦","country":"日本","year":2019,"rating":5,"date":"2022-03-11","synopsis":"离婚、失业、负债缠身的贤治回到秋田老家，参加旧日恋人直子的婚礼。重逢之夜，两人决意重温昔日时光，沉溺于身体的记忆，在情欲与理智之间反复挣扎。","locations":[{"kind":"country","place":"日本","lng":139.69,"lat":35.68,"confidence":0.45}]},{"id":"movie:00278","title":"背靠背，脸对脸","original":"","type":"电影","director":"黄建新、杨亚洲","country":"中国大陆","year":1994,"rating":5,"date":"2022-03-10","synopsis":"某市文化馆副馆长王双立尽忠职守多年，屡任代理馆长却始终无法转正。面对先后空降的两任新馆长，他在职场的明争暗斗中费尽心机，心态也悄然变化。","locations":[{"kind":"country","place":"中国大陆","lng":116.4,"lat":39.9,"confidence":0.45}]},{"id":"movie:00279","title":"山中传奇","original":"山中傳奇","type":"电影","director":"胡金铨","country":"中国香港","year":1979,"rating":5,"date":"2022-03-08","synopsis":"书生何云青受高僧之托深入山中古寺，誊抄一部据说能沟通阴阳的珍贵佛经。寺中众人为争夺经书各怀心思，鬼魅与人心交织，何云青陷入重重纠葛。","locations":[{"kind":"country","place":"中国香港","lng":114.17,"lat":22.32,"confidence":0.45}]},{"id":"movie:00280","title":"迎春阁之风波","original":"迎春閣之風波","type":"电影","director":"胡金铨","country":"中国香港","year":1973,"rating":4,"date":"2022-03-08","synopsis":"元朝末年，蒙古大将李察罕前往陕西偏远的迎春阁，欲取得反元势力的军事地图。客栈女老板万人迷与一群乔装的反元义士暗中布局，誓要夺回地图、保全义军。","locations":[{"kind":"country","place":"中国香港","lng":114.17,"lat":22.32,"confidence":0.45}]},{"id":"movie:00281","title":"空山灵雨","original":"空山靈雨","type":"电影","director":"胡金铨","country":"中国香港","year":1979,"rating":